{
  "schema_version": "1.0.0",
  "record_kind": "aggregate",
  "aggregate_id": "lean01-B01-T0-32x32x32-cpu16-double-wall",
  "campaign_id": "lean01",
  "case_id": "B01_bccFe",
  "variant_id": "T0",
  "size_id": "32x32x32",
  "machine_id": "wsl-rtx-a4000",
  "build_id": "build-cpu-double-0123456",
  "backend": "CPU",
  "gpu_backend": null,
  "omp_threads": 16,
  "requested_precision": "DOUBLE",
  "measurement_profile": "DYNAMICS_ONLY",
  "metric": "process_wall_seconds",
  "unit": "s",
  "nstep": 10000,
  "sample_count": 3,
  "median": 184.213,
  "mad": 0.517,
  "minimum": 183.401,
  "maximum": 185.02,
  "run_ids": [
    "lean01-B01-T0-32x32x32-cpu16-double-s000",
    "lean01-B01-T0-32x32x32-cpu16-double-s001",
    "lean01-B01-T0-32x32x32-cpu16-double-s002"
  ],
  "all_samples_numerical_valid": true,
  "all_samples_environment_valid": true,
  "quality_flags_union": [],
  "authoritative": true,
  "notes": null
}
