{
  "schema_version": "1.0.0",
  "record_kind": "aggregate",
  "aggregate_id": "lean01-B01-T0-32x32x32-cpu16-double-tstep",
  "campaign_id": "lean01",
  "case_id": "B01_bccFe",
  "variant_id": "T0",
  "size_id": "32x32x32",
  "machine_id": "wsl-rtx-a4000",
  "build_id": "build-cpu-double-0123456",
  "backend": "CPU",
  "gpu_backend": null,
  "omp_threads": 16,
  "requested_precision": "DOUBLE",
  "measurement_profile": "DYNAMICS_ONLY",
  "metric": "steady_step_seconds",
  "unit": "s",
  "nstep": null,
  "sample_count": 9,
  "median": 0.018117,
  "mad": 4.1e-05,
  "minimum": 0.018042,
  "maximum": 0.018233,
  "run_ids": [
    "lean01-B01-T0-32x32x32-cpu16-double-s000",
    "lean01-B01-T0-32x32x32-cpu16-double-s001",
    "lean01-B01-T0-32x32x32-cpu16-double-s002",
    "lean01-B01-T0-32x32x32-cpu16-double-s003",
    "lean01-B01-T0-32x32x32-cpu16-double-s004",
    "lean01-B01-T0-32x32x32-cpu16-double-s005",
    "lean01-B01-T0-32x32x32-cpu16-double-s006",
    "lean01-B01-T0-32x32x32-cpu16-double-s007",
    "lean01-B01-T0-32x32x32-cpu16-double-s008"
  ],
  "all_samples_numerical_valid": true,
  "all_samples_environment_valid": true,
  "quality_flags_union": [],
  "authoritative": true,
  "notes": null,
  "nstep_fit_points": [
    2000,
    10000,
    40000
  ],
  "fit_method": "MULTI_NSTEP_LEAST_SQUARES"
}
